yor_Latn	sentiment
Ó burú gan-an pé wọ́n ń ṣe eré náà, àmọ́ ohun tó ń kọ ọ́ tún burú ju ìyẹn lọ.	negative
Ó dára jù lọ kí àwọn tó ń ṣe eré náà máa ṣe ohun tí wọ́n bá fẹ́, àwọn tó ń ṣe eré náà á máa sọ ohun tó ń ṣẹlẹ̀, bí ẹni pé ńṣe ni wọ́n ń fi àwọn ọ̀rọ̀ wọn sọ àwọn ohun tó ń ṣẹlẹ̀.	negative
Gbogbo ohun tó wà nínú fíìmù yìí ló ń sọ nípa owó tó ń wọlé fún àwọn èèyàn	negative
O ti wá gbẹ́ láti jí àkókò rẹ!	negative
Ìwà òmùgọ̀ gbáà ló jẹ́.	negative
Níwọ̀n bí kò ti sí ohun tó lè múni ronú jinlẹ̀, kìkì nínú fífi oríṣiríṣi eré orí kọ́míkà tó ń gbé ní Nollywood nìkan ni ohun tó máa ń múni gbà gbọ́ gan-an.	negative
Ó dájú pé kò ní dùn mọ́ni nínú.	negative
Ó burú, ńṣe ni eré náà máa ń lọ láìdábọ̀, ó sì máa ń dà bíi pé kò sí ibi tí òun máa lọ nígbà míì.	negative
Òótọ́ ni pé orin kan ni, ó sì máa ń jẹ́ kó burú gan-an.	negative
Ìtàn àròsọ ni, eré náà sì burú gan-an, ìtàn náà sì jọni lójú gan-an.	negative
LMAO	negative
Ìjákulẹ̀ ńlá ni pé, 'Levi' jẹ́ eré tí kò ní ète kankan.	negative
"Ó ṣe kedere pé fíìmù náà kò ní àánú ara ẹni, àmọ́ ó mú kí ìrírí ""Igbẹ̀"" di èyí tí kò ní àánú fáwọn tó ń wò ó."	negative
Mo gbà pé ó máa dára gan-an kí fíìmù tó máa gba ìṣẹ́jú mẹ́wàá sí ọgbọ̀n [30] dín ní kí wọ́n lè fi dán omi wò.	negative
eré tí kò ní ète.	negative
Ìsapá tó dára, àmọ́ tó jẹ́ ti amateur láti mú kí olù wo nǹkan yí pa dà.	negative
Fojú inú wo bí wàá ṣe máa ṣe fíìmù tí kò ní àdàkàdekè, fíìmù yìí kò dára tó, tó o bá ti ń ronú pé kí ló ń lọ ní ìparí ìṣẹ́jú márùn-ún, wàá ṣì máa ronú pé kí ló ń lọ.	negative
Àkọlé náà kò dáa rárá.	negative
Wọn kàn ṣe àwọn àríyá, àwọn àríyá àti àwọn fídíò orí àwọn ìwé ìtàn òǹtè-àṣà tí wọn ò mọ̀ dáadáa tí wọ́n ti di aláwọ̀lé lórí àwọn ìkànnì àjọlò orí Íńtáné-èdè Nàìjíríà, wọ́n pe ó ní fíìmù tiwọn, wọ́n sì mú un wá sí sinimá. bí o bá jẹ́ ẹni tó ń ṣe àwọn nǹkan ńlá lórí ìkànnì àjọlò orí Íńtáné-èdè, o ti rí ọ̀pọ̀ lára wọn, ọ̀pọ̀ ìgbà ṣáájú. o kò sì ṣeé ṣe kó o rí wọn bí ohun tó ń ṣe àwọn olùṣẹ̀ṣẹ̀dá bíi mélòó kan níbí yìí, nítorí pé wọn ò lè ṣe dáadáa nínú fífi àríyá ṣe nǹkan, èyí sì mú kí 'Social Media 101' máa ṣe eré tó ń múni láyà, kí ìjíròrò tó ń jẹ́ òru àti ìsọfúnni tó ń bani nínú jẹ́ gan-an.	negative
"Ó dájú pé ọ̀rọ̀ náà ""ọ̀rònú"" ni wọ́n ń sọ."	negative
Mo tún rí fíìmù kan ní Nàìjíríà tí ọ̀pọ̀ èèyàn ti ń sọ nípa rẹ̀, àmọ́ tí kò sí nǹkan kan tí mo lè ṣe, mi ò ní sọ fún ẹnikẹ́ni pé kó ṣe é.	negative
Kò burú bẹ́ẹ̀ rárá, àmọ́ gbogbo ohun tó ń ṣẹlẹ̀ nínú fífi àkọlé ìwé àti fífi ìṣètò ṣe àbáyọ ni.	negative
Àkọlé fíìmù náà kò yéé yéni, kò sì sí àkọsílẹ̀ kankan nípa bí Laila ṣe fara hàn.	negative
Ìtàn tí kò dára gan-an ni wọ́n ń sọ... àti àtúnkọ ìtàn tó pọ̀ gan-an nítorí ohun tí wọ́n ń ṣe nínú fíìmù.	negative
Ó ń ṣe àṣìṣe, ó ń ṣe ohun tí kò tọ́, kò sì ní ìtumọ̀.	negative
Kò sí fíìmù tó dára rárá	negative
Ó máa ń dùn mí gan-an láti rí fíìmù yìí.	negative
ó sọ ìtàn kan tó wà ní pàtó kan tí ẹnì kan lè búra pé ọmọ ilé ìwé ìpilẹ̀ṣẹ̀ kan kọ ní kánjúkánjú fún ìfihàn eré ìdárayá ní Ọdún Ìṣàkóso Ọ̀dọ́ Ọ̀dọ́ Ọdún	negative
Tó o bá mọyì àkókò rẹ, sapá gan-an láti yẹra fún èyí.	negative
Ṣé fíìmù lè burú, àmọ́ ṣe pàtàkì?	negative
Bí mo bá jẹ́ ọ̀jọ̀gbọ́n nípa fíìmù tó ń gbìyànjú láti dá àwọn ọmọ iléèwé mi lẹ́bi, mi ò lè ronú nípa ẹni tó dára jù lọ tí mo lè fi ṣe ìfihàn tí wọ́n fẹ́.	negative
Ó ti pẹ́ gan-an, kò dára láti ṣe eré, kò sí ohun tó ṣe pàtàkì fún un	negative
Àwọn ìtàn tó ń sọni lọ́nà tó lágbára àti ìwà tí kò dára tó ń hù ló ń fi hàn pé ẹni tó ń ṣe bíi pé òun ò dáa ni.	negative
Báwo ni fíìmù kan tó ní irú àwọn nǹkan bẹ́ẹ̀ ṣe máa ń lọ lọ́nà tó ń múni lọ́ra tó sì ń múni lọ́ra tó báyìí?	negative
ìtàn yìí lè gba ìyìn látọ̀dọ̀ àwọn tó ń ṣe àríyànjiyàn, àmọ́ kò tó nǹkan, ó sì rọrùn láti gbàgbé rẹ̀.	negative
"fíìmù yìí kò ní ìtara tó ti tẹ́ńpìlì ""ojú kẹta"" tó wà ní ọdún 1990 tí Pa Olu Jacobs ń ṣe."	negative
Nolllywood ń bá a nìṣó láti máa fi ìtìjú bá wa	negative
"Ìwà ìyanu tí kò ṣeé já ní koro àti ìran ọ̀hún ni ""Jelili's Survival""."	negative
Nígbà tí fíìmù òpìtàn tó ń jẹ́ Chief Daddy parí, tí wọ́n fi ẹni tuntun kan hàn nínú ìran tó kẹ́yìn, ó dá lórí ìmúṣẹ ìmúṣẹ, àmọ́ Chief Daddy 2 mú kí ìparun ọdún kejì di ìsàlẹ̀.	negative
Kò yẹ kí èyí parí sí ibẹ̀... òǹkọ̀wé àfọwọ́kọ tí kò ní ọ̀ràn òpìn-ín.	negative
Kò sí ohun tó lè ṣe fún wọn, gbogbo èèyàn ló sì ń gbọ́ ìròyìn náà.	negative
Ìyẹn ò ní jẹ́ kéèyàn ráyè lo àkókò àti owó rẹ̀	negative
fíìmù yìí kò dára rárá, kódà àwọn ọmọdé pàápàá kò ní gbádùn rẹ̀.	negative
