yor_Latn	sentiment
Bákan náà, iṣẹ́ àgbẹ̀ tún lè jẹ́ ohun tó ń múni ronú jinlẹ̀, tó sì ń múni lọ́kàn le, ó sì jẹ́ ká rí i pé ó léwu gan-an pé kéèyàn kórìíra ara rẹ̀.	negative
Ọ̀nà tó burú jù lọ láti bẹ̀rẹ̀ ọdún ni pé, 'Akpe' jẹ́ àríyànjiyàn.	negative
O lè má kórìíra ara rẹ nítorí pé o rí 'Superstar' àmọ́ o máa ń rí i pé o ò lè mọ nǹkan kan, wàá sì máa wà nínú àárẹ̀.	negative
Ó dájú pé kò ní dáa kí n fi èyí sílẹ̀ fún gbogbo àwọn tó ń ṣe eré náà.	negative
Bíi ti àwọn iṣẹ́ mìíràn tí kò dára bíi tirẹ, 'Knock Out Blessing' ni a ṣe fún ìdí pàtàkì láti fi ṣe ìjìnlẹ̀ ìjẹ́ra àwọn olùṣèṣèwádìí dípò kí ó mú kí àwọn olùgbọ́ ní Nàìjíríà láyọ̀.	negative
Akinnuoye-Agbaje kò mọ ẹni tí Eni jẹ́.	negative
Ojú ẹ̀yìn ni àádọ́ta ìṣẹ́jú tí wọ́n fi ń polówó ilé ìtura kan ní ìlú Lagos, fíìmù sì ń parí lọ.	negative
Ó mà dùn mọ́ mi o o, pé 'Àwùjọ Àwọn Ọmọ Oṣù' jẹ́ àbáyọ fún àwọn tó ní ọ̀pọ̀ ọlá.	negative
tí mo bá sọ fún yín pé fíìmù tó fani mọ́ra ni, ńṣe ni màá parọ́.	negative
Bó tilẹ̀ jẹ́ pé ó pẹ́ tó fi máa ń pẹ́, ìṣòro tó wà nínú 'Funke' ni pé ó máa ń súni, kò sì máa ń kó ìbàjẹ́ báni.	negative
Kò yẹ kí n ṣe bẹ́ẹ̀!	negative
Níkẹyìn, èyí ni ohun tí kò dára tí kò yẹ kí wọ́n gbé wá sí sinimá.	negative
O ṣe pataki lati ṣe akiyesi pe awọn ohun elo ti o wa ni isalẹ ni o wa ni awọn ohun elo ti o ni imọran ti o ni imọran ti o ni imọran ti o ni imọran ti o ni imọran ti o ni imọran ti o ni imọran ti o ni imọran ti o ni imọran ti o ni imọran ti o ni imọran ti o ni imọran ti o ni imọran ti o ni imọran ti o ni imọran ti o ni imọran ti o ni imọran ti o ni imọran ti o ni imọran ti o ni imọran ti o ni imọran ti o ni imọran ti o ni imọran ti o ni imọran ti o ni imọran ti o ni imọran ti o ni imọran ti o ni imọran ti o ni imọran ti o ni imọran ti o ni imọran ti o ni imọran ti o ni imọran ti o ni imọran ti o ni imọran ti o ni imọran ti o ni imọran ti o ni imọran ti o ni imọran ti o ni imọran ti o ni imọran ti o ni imọran ti o ni imọran ti o ni imọran ti o ni imọran ti o ni imọran ti o ni imọran ti o ni imọran ti o ni imọran ti o ni imọran ti o ni imọran ti o ni imọran ti o ni imọran ti o ni imọran ti o ni imọran ti o ni imọran ti o ni imọran ti o ni imọran ti o ni imọran ti o ni imọran ti o ni imọran ti o ni imọran ti o ni imọran ti o ni imọran ti o ni imọran ti o ni imọran ti o ni imọran ti o ni imọran ti o ni imọran ti o ni imọran ti o ni imọran ti o ni imọran ti o ni imọran ti o ni imọran ti o ni imọran ti o ni imọran ti o ni imọran ti o ni imọran ti o ni imọran ti o ni imọran ti o ni imọran ti o ni imọran ti o ni imọran ti o ni imọran ti o ni imọran ti o ni imọran ti o ni imọran ti o ni imọran ti o ni imọran ti o ni imọran ti o ni imọran ti o ni imọran ti o ni imọran ti o ti o	negative
iye àwọn ìwà ìkà tí ọmọ ọdún mẹ́fà yìí hù nínú fíìmù yìí ti di èyí tó pọ̀ jù láti kà.	negative
Ó dára fún àwọn ọmọ ọdún mẹ́rìnlá, ó sì ṣe bíi ìtàn Disney tó mọ́ tónítóní, ó sì ní ìbàlẹ̀ ọkàn.	negative
Àwọn nǹkan tó ń ṣe àwọn èèyàn bíi mélòó kan àti àwọn àkókò tí wọ́n ń fi ìmárale ṣe nǹkan lọ́nà tó ń mú kí wọ́n máa ṣe nǹkan lọ́nà tó ń mú kí wọ́n máa ṣe nǹkan lọ́nà tó ń mú kí wọ́n máa ṣe nǹkan lọ́nà tó ń mú kí wọ́n máa ṣe nǹkan lọ́nà tó ń mú kí wọ́n máa ṣe nǹkan lọ́nà tó ń mú kí wọ́n máa ṣe nǹkan lọ́nà tó ń mú kí wọ́n máa ṣe nǹkan lọ́nà tó ń mú kí wọ́n máa ṣe nǹkan lọ́nà tó ń mú kí wọ́n máa ṣe nǹkan lọ́nà tó ń ṣe wọ́n lọ́nà tó ń ṣe bíi ti tẹlifíṣọ̀n.	negative
Ó kéré tán, ọ̀rọ̀ náà kò tó nǹkan, ó sì ṣeé fojú sọ́nà fún.	negative
Àmọ́, ó ṣeni láàánú pé, àwọn àkókò tó ń tàn kálẹ̀ yìí kò tó nǹkan tí wọ́n lè ṣe láti fi sanwó ńláǹlà láti rí èyí.	negative
Yàtọ̀ síyẹn, ó ṣe kedere pé ohun tó ń ṣẹlẹ̀ láàárín Joseph àti ìyàwó rẹ̀ kì í ṣe ohun tó ń ṣẹlẹ̀, àmọ́ mo rò pé ìwé tó ń gbéni ró ni èyí ju fíìmù lọ.	negative
Nítorí náà, àwọn tó ń gbọ́ ọ̀rọ̀ náà máa ń gbọ́ ohùn àwọn tó ń gbọ́ ọ̀rọ̀ náà látìgbàdégbà	negative
Kò sí ẹni tó yẹ kí ó wo fíìmù tí kò dára yìí.	negative
Snooze Fest, kò sí ìtàn púpọ̀, àwọn orin tó ń ṣe àríyànjiyàn	negative
tó o bá fi ADR tó burú jáì kún un, tó o sì fi nǹkan tó burú jáì kún un, wàá ní àlá àbáyọ.	negative
Kò ní ṣe gbogbo nǹkan lápapọ̀, ṣùgbọ́n ó burú tí àwọn tó ń ṣe àwọn fíìmù kò bá pàdánù ẹ̀rọ náà, tí wọ́n á sì kọsẹ̀, tí wọ́n á sì máa ṣòfò, tí wọ́n á sì máa fi nǹkan yìí ṣe nǹkan títí tí fíìmù wọn ní Nollywood yóò fi tóbi sí Bollywood, láìní ìlàlóye, ìbẹ̀rù tàbí ìmúratán láti fi hàn pé ó yẹ.	negative
Ó ń dà bí ẹni tí kò tóbi, ó sì ń dà bí òmùgọ̀!	negative
Àkọlé fíìmù àkọ́kọ́ tó ní àbùkù, àmọ́ ó fi hàn pé ó ní ìmúṣẹ tó dára	negative
Ní ti fíìmù tí àwọn èèyàn ń gbé yìí, mi ò lè sọ pé ó sàn ju àwọn tí kò mọ nǹkan kan lọ,	negative
O ti ṣe nínú ọ̀run jẹ́ fíìmù òmùgọ̀. Ó jẹ́ òmùgọ̀ gan-an, ó máa ń mú ọ bínú débi pé wàá fi máa rẹ́rìn-ín nítorí ìjákulẹ̀ tó kọjá àfẹnusọ. O máa rẹjú gan-an tó o bá ń wo fíìmù náà, o ò ní lè rí ara rẹ pé o kàn ń gbádùn ìwà òmùgọ̀ tí fíìmù òmùgọ̀ yìí ń hù.	negative
Ó ń rìn díẹ̀, ó ń ṣe dáadáa, ó sì ní ìbẹ̀rù díẹ̀, àmọ́ òpin kò dùn mọ́ni nínú.	negative
"Níwọ̀n bí kò ti sí ìjì líle tó dára, má ṣe fi ""Dagger"" yìí pa owó rẹ ní ọkàn rẹ."	negative
Nígbà tí mo sọ pé ohun tó ń mú ká máa ṣe eré ìdárayá ń sọ àwọn ohun tá à ń sọ di ọ̀rọ̀ òmùgọ̀, èyí jẹ́ àpẹẹrẹ tó dára jù lọ.	negative
Tó o bá ti wo Chief Daddy: Going For Broke ní ọdún tuntun tó jáde lórí Netflix, tó o sì gbà pé ó máa di fíìmù tó burú jù lọ ní ọdún yìí, mọ̀ pé kì í ṣe ẹ̀bi rẹ ni;	negative
Ó máa ń jẹ́ kí ọkàn èèyàn bà jẹ́!	negative
Snooze Fest, kò sí ìtàn púpọ̀, àwọn orin tó ń ṣe àríyànjiyàn	negative
Fìlíìmù náà kò dára gan-an, ó ní àwọn òǹwòran náà ti ń ṣe àṣejù (ó ṣeé ṣe kí wọ́n ti ń darí wọn jù?) àmọ́ àyíká tó wà nínú rẹ̀ dára gan-an.	negative
Ó kéré tán, owó tó pọ̀ tó bẹ́ẹ̀ kò tó nǹkan.	negative
Ohun tó dára gan-an ni, ó burú gan-an nígbà tí wọ́n bá ṣe ìwádìí.	negative
Kò yẹ ká ṣe bẹ́ẹ̀.	negative
Ìtàn tó dára, eré tí kò dára.	negative
fíìmù kan tó ní àwọn ìràwọ̀ tó mú kí àwọn ìràwọ̀ dà bí ẹni pé àwọn ń ṣe eré ìdárayá nínú ilé ọ̀dọ́	negative
Kò yẹ ká ṣe bẹ́ẹ̀.	negative
Ó ṣe ohun tí kò dára, ó burú, ó ṣe ìtìjú, ó sì ń tàn kálẹ̀.	negative
Bí mo ṣe ń ṣe fíìmù yìí mú kí n fẹ́ràn rẹ̀ gan-an, àmọ́ ó ṣòro láti gbádùn rẹ̀ lábẹ́ àlàyé tí kò tọ́ nípa fíìmù tí Genevieve Nnaji kọ.	negative
Ó dájú pé, ọ̀kan lára àwọn fíìmù ìbẹ̀rù tó burú jù lọ tí wọ́n ti ṣe rí...	negative
Bó bá tiẹ̀ jẹ́ pé ọ̀rọ̀ nípa fífi ìṣeré ṣe eré, àbá ìwé ìtàn, ó yàtọ̀ sí ti ayé yìí	negative
"Bó tilẹ̀ jẹ́ pé wọ́n fi èké pe ""Ìṣekúṣe"", 'Bridal Shower' kì í ṣe fíìmù Ìṣekúṣe rárá."	negative
Kò sí ohun tó lè ṣe é, torí pé owó ni wọ́n ń kó jọ.	negative
Ìjákulẹ̀ Tó Gbéṣẹ́	negative
Ó máa ń dà bí ẹni pé ó ń dà á láàmú	negative
Ó fani mọ́ra, àmọ́ kò ní agbára kankan	negative
Àwọn ohun tó ń mú kí 'Àwòrán Àpéjọ' di èyí tí kò dára, ó sì ti di èyí tó ń mú kí wọ́n ṣe ohun tó tọ́.	negative
Ó ń rọ̀ lọ́nà tó ń mú kí nǹkan máa ṣe kedere.	negative
àmọ́, ohun tó ń dunni àti orin tó ń kọni kò dáa débi pé ó pa gbogbo ohun tó dára run	negative
Mi ò rí gbogbo ọ̀rọ̀ òmùgọ̀ yìí, kódà kò sí ọ̀rọ̀ òmùgọ̀ tó ń mú ẹ̀yà èèyàn wá látọ̀dọ̀ orílẹ̀-èdè kan ní Áfíríkà tí kò sí ilé iṣẹ́ sinimá.	negative
Ọ̀rọ̀ tó dáa, kò sì dára	negative
Ìṣeré náà kò dára, orin náà tún ń sọ ọ́ léraléra, ìtàn náà sì ń sọ ọ́ léraléra.	negative
Ohun tó ń gbé ìsọfúnni náà lárugẹ, àmọ́ ọ̀ràn ọ̀ràn ọ̀ràn ọ̀ràn ọ̀ràn ọ̀ràn náà dára rárá.	negative
Ìṣètò tó ń ṣeni láàánú àti tí kò bójú mu nípa ìwé kan tó ní ìjìnlẹ̀ (tí kò tíì fara hàn)	negative
"Kò sí ohun tó dára nínú ""Irú Ohun Tó Ń Fi Wa Bára Mu""."	negative
fíìmù yìí kò rọrùn láti ṣe, àmọ́ ọkàn rẹ̀ ò tó nǹkan.	negative
Bí fíìmù náà ṣe ń gbé ìjíròrò rẹ̀ kà nípa àjọṣe tó wà láàárín Joseph àti Suzy, kò fi béèyàn ṣe lè mọ̀ nípa ìṣẹ̀lẹ̀ tó wáyé ní February 13, 1976, tó mú kí Olusegan Obasanjo wá sípò.	negative
Ẹ jọ̀wọ́, ẹ má fi owó Naira yín san èrè fún wọn.	negative
fíìmù yìí ló máa jẹ́ eré àròjinlẹ̀ tó máa ń bani nínú jẹ jù lọ tá a ti rí.	negative
Ó ṣeé ṣe kó jẹ́ pé èyí tó burú jù lọ nínú fíìmù tí wọ́n fi owó tó pọ̀ ṣe ni.	negative
Ó ń lọ pẹ́ gan-an, ńṣe ló ń sọ àkókò nù.	negative
Mi ò lè gbà pé mo lo wákàtí méjì láti wo fíìmù yìí	negative
mi ò fẹ́ràn fíìmù yìí rárá	negative
Ó fẹ́rẹ̀ẹ́ jẹ́ pé kò sí ohun tó ń ṣẹlẹ̀.	negative
Àwọn ìjíròrò tó ń fa ìjábá, àwọn ìjábá tó ń fa ìjábá.	negative
Láti ìdarí tí kò dára sí ìtàn tí kò dára sí; láti ìṣeré tó ń ṣeni láàánú sí àìlọ́gbọ́n-únlò; láti fífi àwòrán ṣe àfihàn àfiwé tó ń ṣeni láàánú sí fífi àtúnṣe tó ń ṣeni láàánú.	negative
Fìlíìmù yìí kò dára.	negative
Yàtọ̀ sí pé ó ṣeé fojú rí gan-an, ó sì máa ń ṣe eré tó wà nísàlẹ̀ ìwọ̀nba, ọ̀pọ̀ ìgbà ni àwọn èèyàn máa ń gbìyànjú láti dá àwọn ohun tó ti di ohun ìjà tó ti di ohun ìjà fún àwọn ọ̀daràn tó ti di ohun ìjà.	negative
Mo kórìíra bí wọ́n ṣe ń pè fíìmù yìí ní orúkọ.	negative
Ó sì ń dùn ún wò, 'Efunsetan Aniwura' jẹ́ ìtàn tó ń sọ ìtàn tó ń bani nínú jẹ́ tó sì ń bani nínú jẹ́ gan-an.	negative
Mo ti di livid	negative
ÀWỌN ÀWỌN ÀWỌN ÀWỌN ÀWỌN ÀWỌN ÀWỌN ÀWỌN ÀWỌN ÀWỌN ÀWỌN ÀWỌN ÀWỌN ÀWỌN ÀWỌN ÀWỌN ÀWỌN ÀWỌN ÀWỌN ÀWỌN ÀWỌN ÀWỌN ÀWỌN ÀWỌN ÀWỌN ÀWỌN ÀWỌN ÀWỌN ÀWỌN ÀWỌN ÀWỌN ÀWỌN ÀWỌN ÀWỌN ÀWỌN ÀWỌN ÀWỌN ÀWỌN ÀWỌN ÀWỌN ÀWỌN ÀWỌN ÀWỌN ÀWỌN ÀWỌN ÀWỌN ÀWỌN ÀWỌN ÀWỌN ÀWỌN ÀWỌN ÀWỌN ÀWỌN ÀWỌN ÀWỌN ÀWỌN ÀWỌN ÀWỌN ÀWỌN ÀWỌN ÀWỌN ÀWỌN ÀWỌN ÀWỌN ÀWỌN ÀWỌN ÀWỌN ÀWỌN ÀWỌN ÀWỌN ÀWỌN ÀWỌN ÀWỌN ÀWỌN ÀWỌN ÀWỌN ÀWỌN ÀWỌN ÀWỌN ÀWỌN	negative
ÀWỌN ÀWỌN ÀWỌN ÀWỌN ÀWỌN	negative
fíìmù yìí ṣèlérí ohun tó pọ̀ gan - an, àmọ́ ó wá di èyí tó ń múni ṣeré.	negative
Wọ́n máa ń lo káàdì ìkọlé ìwé tí wọ́n fi ń ṣe ìsọfúnni nípa àwọn èèyàn...	negative
Bó tilẹ̀ jẹ́ pé fíìmù náà kò fara rọ, ó sì dà bí ẹni pé kò ní nǹkan ṣe.	negative
Ó ṣèlérí pé àwọn á máa rẹ́rìn-ín, àmọ́ eré náà kò tó nǹkan, ó sì mú kí wọ́n máa rẹ́rìn-ín ju pé kí wọ́n máa rẹ́rìn-ín bí wọ́n bá lọ sí sinimá.	negative
Abigail kò dára gan-an, ẹni burúkú náà kì í ṣe ẹni tó ń fi àbùkù ṣe nǹkan, wọ́n sì rí i pé kò dáa fáwọn èèyàn dúdú láti máa rìnrìn àjò lọ sí ìgbà tí wọ́n ti wà láàyè.	negative
Ìjákulẹ̀ ńlá ló jẹ́ fún obìnrin tó kópa nínú eré náà.	negative
Ìparí ọ̀rọ̀ náà nìkan ni mo gbádùn jù lọ.	negative
Ìwà ìríra ni, ìtìjú àti ìṣe búburú fún CNA.	negative
Àkọlé àwòrán, Àkọlé àwòrán, Àkọlé àwòrán, Àkọlé àwòrán, Àkọlé àwòrán, Àkọlé àwòrán, Àkọlé àwòrán, Àkọlé àwòrán, Àkọlé àwòrán, Àkọlé àwòrán, Àkọlé àwòrán, Àkọlé àwòrán, Àkọlé àwòrán, Àkọlé àwòrán, Àkọlé àwòrán, Àkọlé àwòrán, Àkọlé àwòrán, Àkọlé àwòrán, Àkọlé àwòrán, Àkọlé àwòrán, Àkọlé àwòrán, Àkọlé àwòrán, Àkọlé àwòrán, Àkọlé àwòrán, Àkọlé àwòrán, Àkọlé àwòrán, Àkọlé àwòrán, Àkọlé àwòrán, Àkọlé àwòrán, Àkọlé àwòrán, Àkọlé àwòrán, Àkọlé àwòrán, Àkọlé àwòrán, Àkọlé àwòrán, Àkọlé àwòrán, Àkọlé àwòrán, Àkọlé àwòrán, Àkọlé àwòrán, Àkọlé àwòrán, Àkọlé àwòrán, Àkọlé àwòrán, Àkọlé àwòrán, Àkọlé àwòrán, Àkọlé àwòrán, Àkọlé àwòrán, Àkọlé àwòrán, Àkọlé àwòrán, Àkọlé àwòrán, Àkọlé àwòrán, Àkọlé àwòrán, Àkọlé, Àkọlé, Àkọlé, Àkọlé, Àkọlé, Àkọlé na Ara Ara Ara Ara Ara Ara Ara Ara Ara Ara Ara Ara Ara Ara Ara Ara Ara Ara Ara Ara Ara Ara Ara Ara Ara Ara Ara Ara Ara Ara Ara Ara Ara Ara Ara Ara Ara Ara Ara Ara Ara Ara Ara Ara Ara Ara Ara Ara Ara Ara Ara Ara Ara Ara Ara Ara Ara Ara Ara Ara Ara Ara Ara Ara Ara Ara Ara Ara Ara Ara Ara Ara Ara Ara Ara Ara Ara Ara Ara Ara Ara Ara Ara Ara Ara Ara Ara Ara Ara Ara Ara Ara Ara Ara Ara Ara Ara Ara Ara Ara Ara Ara Ara Ara Ara Ara Ara Ara Ara Ara Ara Ara Ara Ara Ara Ara Ara Ara Ara Ara Ara Ara Ara Ara	negative
ó dà bí ìgbà tí mo rí fíìmù tó dára nílẹ̀ áfíríkà ní ọdún 2012? tó bá rí bẹ́ẹ̀... ó dára gan-an! mo ní láti bi ara mi pé (nírú ọ̀ràn yìí) ṣé ó ti dára jù lọ ní ọdún 2021?	negative
Ojúṣe fíìmù kan tí kò dára rárá ni Knock Out Blessing, tí kò sì yẹ kí wọ́n ṣe, tàbí kó máà tiẹ̀ yẹ kí wọ́n dá sílẹ̀ fún gbogbo èèyàn.	negative
Ó kọjá àyè kan.	negative
Ó ṣeé ṣe kó jẹ́ nítorí pé kò sí ìsọfúnni tó ń mú kí ìsọfúnni náà máa jáde.	negative
Suga Suga ní àwọn ìran tó ń yíjú sí i tó pọ̀ jù, èyí sì mú kí ìjíròrò tó wáyé láàárín àwọn èèyàn tó ní ìṣòro tó le koko parí.	negative
Ó dùn mí gan-an pé, nígbà tí Enitan kúrò ní ọkàn tó ti kú, ó di ọ̀mọ̀wé, ó sì wá di òǹkọ̀wé, ó di pé ó di ẹni tó ń gbé ní ìṣẹ́jú ìkẹyìn tó kù lẹ́yìn gbogbo ìjákulẹ̀ tó wáyé.	negative
Mo ti wa ni ni ireti ohun kan ti o dara ju crude ṣe, ati ni iwọn nla eyi jẹ otitọ. Bi o ti wa ni diẹ ninu awọn ti o dara ju kọ awọn aworan ati / tabi itọsọna ti o tọka si pe nigbakan diẹ ninu awọn gidi igbiyanju ti a ti ṣe nipasẹ awọn onisefiimu, awọn fiimu ni o ni Elo diẹ awọn ailagbara. Awọn sinima jẹ unimpressive, nibẹ ni o wa gidigidi kekere ni ọna ti awọn iṣelọpọ iye, ati awọn ifiṣere nipasẹ ọpọlọpọ awọn oṣere ni amateur.	negative
Ó ṣeni láàánú pé a ò lè fara da àwọn ìbọn akọ̀boyì, ìbọn àgbááláyé, aṣọ tí a fi ń ṣe àpéjọ, fífi àwòrán ṣe àwọn nǹkan tí kò ní láárí àti àwọn àjọ̀dún ìrántí tó ń múni ronú jinlẹ̀ nípa àwọn ohun tó ti hàn tán, gbogbo èyí ló kún fún àwọn ìfihàn tí kò tọ́ nípa àwọn tó ń ṣe ìjìyà tó ti fara hàn látìbẹ̀rẹ̀.	negative
Ó ṣeni láàánú pé, fíìmù náà sábà máa ń jẹ́ alágbára àti aláàlà, ó sì máa ń ní àwọn ìṣẹ̀lẹ̀ tó ń mú kí ọkàn èèyàn máa fà sí nǹkan nígbà tí ojú ọjọ́ bá ń ṣú.	negative
Fìlíìmù náà kò dára gan-an, ó ní àwọn òǹwòran náà ti ń ṣe àṣejù (ó ṣeé ṣe kí wọ́n ti ń darí wọn jù?) àmọ́ àyíká tó wà nínú rẹ̀ dára gan-an.	negative
Ìgbà kan wà tí mo rí i pé ó ń ṣe mí bíi pé mo ti ń ṣe nǹkan kan.	negative
Bó ti wù kó rí, o ò lè mọ ibi tó o wà tàbí irú ẹni tó o jẹ́, torí pé ó ti pọ̀ jù láti fi hàn pé o ò lè mọ ohun tó o fẹ́ ṣe.	negative
Fìlíìmù yìí máa ń súni gan-an fún sinimá.	negative
kò dára	negative
A pe èyí ní ìfọ̀tínà-àtìgbà-àtìgbà-àtìgbà-àtìgbà-àtìgbà-àtìgbà-àtìgbà-àtìgbà-àtìgbà-àtìgbà-àtìgbà-àtìgbà-àtìgbà-àtìgbà-àtìgbà-àtìgbà-àtìgbà-àtìgbà-àtìgbà-àtìgbà-àtìgbà-àtìgbà-àtìgbà-àtìgbà-àtìgbà-àtìgbà-àtìgbà-àtìgbà-àtìgbà-àtìgbà-àtìgbà-àgbà-àgbà-àgbà-àgbà-àgbà-àgbà-àgbà-àgbà-àgbà-àgbà-àgbà-àgbà-àgbà-àgbà-àgbà-àgbà-àgbà-àgbà-àgbà-àgbà-àgbà-àgbà-àgbà-àgbà-àgbà-àgbà-àgbà-àgbà-àgbà-àgbà-àgbà-àgbà-àgbà-àgbà-àgbà-àgbà-àgbà-àgbà-àgbà-àgbà-àgbà-àgbà-àgbà-àgbà-àgbà-àgbà-àgbà-àgbà-àgbà-àgbà-àgbà-àgbà-àgbà-àgbà-àgbà-àgbà-àgbà-àgbà-àgbà-àgbà-àgbà-àgbà-àgbà-àgbà-àgbà-àgbà-àgbà-àgbà-àgbà-àgbà-àgbà-àgbà-àgbà-àgbà-àgbà-àgbà-àgbà-à-àgbà-àgbà-à-àgbà-à-àgbà-àgbà-à-àgbà-àgbà-à-à	negative
Ṣé ẹnì kan rán ìwé ìpilẹ̀ṣẹ̀ Netflix tí kò tọ́ sí Nàìjíríà lọ bí ẹni pé ó jẹ́ aṣọ ìbọ̀n tí àwọn tó pàdánù nínú ìdíje Super Bowl ń wọlé?	negative
"Àwọn ìtàn tó ń sọ ìtàn tó lágbára àti eré tó ń kó ìtìjú báni ni àwọn àmì tó ń fi hàn pé ẹni tó ń ṣe bíi pé òun kò dáa yìí ń ṣe nǹkan - èyí lè máa ṣe é bíi pé ó ń ṣe àdàkàdekè, àmọ́, fíìmù yìí dà bí fíìmù tí wọ́n fi ń ṣe ""Isoken""."	negative
Àwàdà ni fíìmù yìí.	negative
Ó burú gan-an! Ó dájú pé èyí ni fíìmù tó burú jù lọ tí mo ti rí láyé mi!	negative
Àwọn ìṣẹ̀lẹ̀ tó wáyé nínú eré náà kò burú, ọkàn rẹ̀ sì wà ní ibi tó yẹ, àmọ́ ó máa ń dun gan-an láti wo àwọn nǹkan tó ń ṣẹlẹ̀ láwọn ibì kan.	negative
Bó tilẹ̀ jẹ́ pé iṣẹ́ fíìmù náà dà bí ẹni pé ọ̀jáfáfá, má ṣe jẹ́ kí fíìmù yìí tàn ẹ́ jẹ.	negative
Kò sí orí, kò sí ẹrù, kò sí àkọsílẹ̀ tó dáa, kò sí àkókò tó pọ̀, kò sì sí ohun tó ń náni lówó lọ́wọ́.	negative
Àní àwọn ìràwọ̀ wọn ò ní irú ojú tí wọ́n fi ń wo fíìmù yìí	negative
Àwa èèyàn rẹ̀	negative
Ìdájọ́: Kò yẹ ká sọ pé ká ṣe é.	negative
Ó dùn mí gan-an pé àwọn tó ń ṣe eré náà (ìyẹn ọba àti Amina) máa ń ṣe àwọn nǹkan kan tó ń mú kí n rẹ́ mi lára yá, àmọ́ ó ṣòro fún mi láti mọ bí ẹni tó ń ṣe eré náà ṣe ń rí lára mi, torí pé ojúṣe rẹ̀ yẹ kó jẹ́ ojúṣe pàtàkì.	negative
Kò sí ẹni tó lè gbà á níyànjú, kódà àwọn ọmọdé pàápàá.	negative
Ẹ fi ọwọ́ rẹ̀ sí lára àwọn fíìmù tí kò dáa jù tí mo ti rí	negative
Ó burú jù lọ nínú fífi àwòrán tó ń darí ṣe nǹkan nígbà tí Ahannas ń rántí ìgbà tí wọ́n ń dáná sun ọkùnrin kan.	negative
Àdàn. . . . Àdàn kan sí i láti NETFLIX. Àkókò !!	negative
Ó ní àṣìṣe ńlá	negative
Mo ti ṣe àyẹ̀wò rẹ̀. Kò sí bí mo ṣe ń wo gbogbo nǹkan yìí.	negative
wàá kábàámọ̀ pé o ti ń wo fíìmù yìí.	negative
Àwọn Òtòṣì	negative
Ó jẹ́ ohun ìpilẹ̀ṣẹ̀ gan-an.	negative
Àwọn Mílíọ̀nù jẹ́ ìfọwọ́sowọ́pọ̀ tí kò lẹ́gbẹ́ nípa àwọn ìwé àfọwọ́kọ 'ìwọ̀n fíìmù Ocean' tí kò ní ìtìjú, èyí ò sì mú wa láàmú.	negative
"Gbarada' jẹ ""ìwé Yorùbá"" tí wọ́n ń ṣe ní ìlú Idumota, tí gbogbo ìwà òmùgọ̀ tó wà nínú fíìmù Nollywood yìí ń bá a lọ."	negative
Ojú ẹ̀ ń wò ó, ẹ̀mí ìbàjẹ́ ni àwọn òǹkọ̀wé náà ń hù.	negative
fíìmù tó burú jù lọ tí mo ti rí	negative
O kàn ń ṣe àbùkù	negative
Special Jollof' jẹ ẹ̀yẹ̀kàmàmà mìíràn láti Nollywood ní Diaspora. àti bí ó ti ṣe wọ́pọ̀; ó jẹ́ kí ìtàn yéyé àti ọ̀pọ̀ eré ìdárayá tó ní ọkàn tó fẹ́rẹ̀ẹ́ fẹ́rẹ̀ẹ́ fẹ́rẹ̀ẹ́ fẹ́rẹ̀ẹ́ fẹ́rẹ̀ẹ́ fẹ́rẹ̀ẹ́ fẹ́rẹ̀ẹ́ fẹ́rẹ̀ẹ́ fẹ́rẹ̀ẹ́ fẹ́rẹ̀ẹ́ fẹ́rẹ̀ẹ́rẹ̀ẹ́ fẹ́rẹ̀ẹ́rẹ̀ẹ́ fẹ́rẹ̀ẹ́rẹ̀ẹ́ fẹ́rẹ̀ẹ́rẹ̀ẹ́ fẹ́rẹ̀ẹ́rẹ̀ẹ́ fẹ́rẹ̀ẹ́rẹ̀ẹ́ fẹ́rẹ̀ẹ́rẹ̀ẹ́ fẹ́rẹ̀ẹ́rẹ̀ẹ́ fẹ́rẹ̀ẹ́rẹ̀ẹ́ fẹ́rẹ̀ẹ́rẹ̀ẹ́rẹ̀ẹ́ fẹ́rẹ̀ẹ́rẹ̀ẹ́rẹ̀ẹ́ fẹ́rẹ̀ẹ́rẹ̀ẹ́rẹ̀ẹ́ fẹ́rẹ̀ẹ́rẹ̀ẹ́rẹ̀ẹ́ fẹ́rẹ̀ẹ́rẹ̀ẹ́rẹ̀ẹ́ fẹ́rẹ̀ẹ́rẹ̀ẹ́ fẹ́rẹ̀ẹ́rẹ̀ẹ́rẹ̀ẹ́ fẹ́rẹ̀ẹ́rẹ̀ẹ́ fẹ́rẹ̀ẹ́rẹ̀ẹ́ fẹ́rẹ̀ẹ́rẹ̀ẹ́rẹ̀ẹ́ fẹ́rẹ̀ẹ́rẹ̀ẹ́ fẹ́rẹ̀ẹ́rẹ̀ẹ́rẹ̀ẹ́ fẹ́rẹ̀ẹ́ fẹ́rẹ̀ẹ́rẹ̀ẹ́rẹ̀ẹ́ fẹ́rẹ̀ẹ́rẹ̀ẹ́rẹ̀ẹ́rẹ̀ẹ́ fẹ́rẹ̀ẹ	negative
Mo lè sọ pé, bí Luna ṣe ń ṣe ìrì jẹ́ ìtàn tó ń kóni ní ìrẹ́jẹ ju bí bàbá àgbà ṣe ń ṣe ìrìírí méjì lọ.	negative
mi ò mọ iye àwọn jàǹbá ọkọ̀ òfuurufú tó wáyé ní nàìjíríà, fíìmù yìí sì jáde láàárín ọjọ́ márùn-ún	negative
Ó dájú pé fíìmù yìí á dára gan - an tí a bá ti ṣètò owó púpọ̀ sí i .	negative
Kò sí ọ̀nà tó lè yí pa dà, kò sì sí ọ̀nà tó lè mú kí ọ̀rọ̀ náà rọrùn láti lóye.	negative
Kò tó àkókò rẹ	negative
O jẹ ohun tí kò rí bẹ́ẹ̀ tí mo fi fi fi fíìmù sílẹ̀, mi ò lè parí èyí, mo fi í sílẹ̀ lẹ́yìn ọ̀kẹ́ mẹ́ta.	negative
níkẹyìn, ó mú kí fíìmù náà di èyí tó lágbára jù, tó máa ń múni gbóná janjan, tó sì máa ń múni ní ìbànújẹ́ tó lágbára.	negative
Ó ṣeni láàánú pé àwọn àpẹẹrẹ tá a mẹ́nu kàn yìí kò dá sí pé àwọn èèyàn ò fi bẹ́ẹ̀ kíyè sí àwọn kúlẹ̀kúlẹ̀.	negative
Ó dà bí ìgbà téèyàn ń dán àgò wáìnì wò, tí kò tíì dàgbà dénú, bóyá tí wọ́n fi àjàrà tí kò tíì pẹ́ ṣe.	negative
Fìlíìmù yìí kì í ṣe ohun tó dáa.	negative
fíìmù yìí máa ń dà bí ohun tó ń súni gan - an, ó sì máa ń bani nínú jẹ́ gan - an	negative
Àwọn ọ̀rọ̀ tí kò tọ́ ni wọ́n fi ń sọ pé, 'Ohun Tó Ṣàṣìṣe' jẹ́ ọ̀rọ̀ tí kò tọ́!	negative
Mo ní láti wo eré náà fún ìdí ìdánilẹ́kọ̀ọ́.	negative
Ó ń lọ pẹ́ gan-an, ńṣe ló ń sọ àkókò nù.	negative
Ó ń bú.	negative
Fíìmù yẹn kò dára fún Nollywood rárá.	negative
Mo rí àbùkù Nollywood nígbà tí mo ń wo Rattlesnake.	negative
Pẹ̀lú gbogbo àwọn àríwísí tó ń múni ṣeré àti àwọn eré tó ń gbéni ró tó máa ń yí pa dà láàárín ṣíṣe àṣejù àti ṣíṣe ìwàkiwà.	negative
Gbogbo èèyàn ló ń ṣe eré náà, ọ̀pọ̀ àwọn èèyàn ni kò sì tíì dàgbà dénú.	negative
Owó àti àkókò	negative
O ó kórìíra rẹ̀	negative
Ọ̀rọ̀ tó dára gan - an, ṣùgbọ́n ó jẹ́ ìgbẹ́jú àwọn wákàtí méjì tí kò ní láárí.	negative
Bó bá tiẹ̀ ṣeé ṣe, ńṣe ni 'Ìyáàfin' náà fi hàn pé òun ò lè ṣe ohunkóhun, torí pé kò mú ìlérí tó ṣe fún wọn ṣẹ.	negative
Oògùn tí kò dára, kò tó láti fi hàn, àwọn òṣèré kò lágbára, ọmọ ọdún méjìlá ló kọ ìwé náà, kò sì ní ìró rere.	negative
Bí wọ́n ṣe ń ṣe eré ìtàgé tó ń gbé àwọn èèyàn ró, tí wọ́n sì ń gbé ní Nàìjíríà nígbà ogun abẹ́lé tó wáyé ní ọdún 1960s, ó wá di àṣìṣe kan tó burú jáì nínú ìrìn àjò wọn, èyí tí wọ́n fi ń ṣe iṣẹ́ tó ní ìtẹ́lọ́rùn yìí kò sì lè dáàbò bò ó pátápátá.	negative
Àmọ́, kò sí ohun tó lè mú kí èyí súni.	negative
Ó burú gan-an, àmọ́ fíìmù náà ṣì ń gbádùn mọ́ni.	negative
Ó burú gan-an pé àwọn tó ń kópa nínú eré náà ṣe ohun tí kò dára.	negative
Ó máa ń gbádùn mọ́ni bó tilẹ̀ jẹ́ pé kò ní àṣìṣe kankan	negative
Fìlíìmù yìí dà bí àpò pọ̀ tó ní èrò tó ti ń gbéni ró, tó sì ní ìfẹ́ ọkàn tó ní í ṣe pẹ̀lú ohun tó ń ṣẹlẹ̀.	negative
Àkọlé fíìmù náà ò lè jẹ́ ohun táwọn akẹ́kọ̀ọ́ gíga máa ń ṣe gẹ́gẹ́ bí olùṣe amátì.	negative
Mo kórìíra fíìmù yìí gan-an	negative
